<?xml version="1.0"?>
<config xmlns:xsi="http://www.w3.org/2001/XMLSchema-instance" xsi:noNamespaceSchemaLocation="urn:magento:module:Firegento/ContentProvisioning/etc/content_provisioning.xsd">
    <page identifier="foobar" maintained="true">
        <stores>
            <store code="default" />
        </stores>
        <content type="file">path/to/file.html</content>
    </page>
    <page identifier="test" maintained="false">
        <stores>
            <store code="*" />
        </stores>
        <content><![CDATA[this is some sample content...]]></content>
    </page>
    <block identifier="test" maintained="false">
        <stores>
            <store code="*" />
        </stores>
        <content><![CDATA[this is some sample content...]]></content>
    </block>
    <block identifier="test2" maintained="false">
        <content><![CDATA[this is some sample content...]]></content>
        <stores>
            <store code="default" />
            <store code="admin" />
        </stores>
    </block>
</config>
